[
  { "name": "Fire Flakes", "description": "Crispy, spicy chips from the Fire Nation.", "region": "fire nation", "id": "fire-flakes", "type": "food", "slug": "fire-flakes", "tags": [], "image": null, "aliases": [], "sources": [] },
  { "name": "Sea Prunes", "description": "A Water Tribe delicacy, notoriously acquired taste.", "region": "water tribe", "id": "sea-prunes", "type": "food", "slug": "sea-prunes", "tags": [], "image": null, "aliases": [], "sources": [] },
  { "name": "Komodo Sausage", "description": "Spicy sausage made from komodo chicken.", "region": "fire nation", "id": "komodo-sausage", "type": "food", "slug": "komodo-sausage", "tags": [], "image": null, "aliases": [], "sources": [] },
  { "name": "Mango Jerky", "description": "Dried, chewy mango snack popular with Air Nomads.", "region": "air nomad", "id": "mango-jerky", "type": "food", "slug": "mango-jerky", "tags": [], "image": null, "aliases": [], "sources": [] },
  { "name": "Moon Peaches", "description": "Sweet, juicy peaches from the Earth Kingdom.", "region": "earth kingdom", "id": "moon-peaches", "type": "food", "slug": "moon-peaches", "tags": [], "image": null, "aliases": [], "sources": [] },
  { "name": "Cactus Juice", "description": "Strange, potent drink found in the Si Wong Desert.", "region": "earth kingdom", "id": "cactus-juice", "type": "food", "slug": "cactus-juice", "tags": [], "image": null, "aliases": [], "sources": [] },
  { "name": "Momo's Fruit Pie", "description": "Pastry stuffed with assorted fruits, favorite of Momo.", "region": "air nomad", "id": "momos-fruit-pie", "type": "food", "slug": "momos-fruit-pie", "tags": [], "image": null, "aliases": [], "sources": [] },
  { "name": "Unagi Sushi", "description": "Freshwater eel dish, local specialty of Kyoshi Island.", "region": "earth kingdom", "id": "unagi-sushi", "type": "food", "slug": "unagi-sushi", "tags": [], "image": null, "aliases": [], "sources": [] },
  { "name": "Steamed Seaweed Noodles", "description": "Healthy and light, often served by the Foggy Swamp Tribe.", "region": "water tribe", "id": "steamed-seaweed-noodles", "type": "food", "slug": "steamed-seaweed-noodles", "tags": [], "image": null, "aliases": [], "sources": [] },
  { "name": "Plum Bao", "description": "Steamed buns filled with tart plum jam.", "region": "earth kingdom", "id": "plum-bao", "type": "food", "slug": "plum-bao", "tags": [], "image": null, "aliases": [], "sources": [] }
]
